Search title,title,lyrics,credits/comments,google drive link/embedded file,youtube link
<<<<<<< Updated upstream
<<<<<<< Updated upstream
<<<<<<< Updated upstream
<<<<<<< Updated upstream
"Avinu Av Harachaman, אָבִֽינוּ אָב הָרַחֲמָן",,"אָבִֽינוּ אָב הָרַחֲמָן
הַמְרַחֵם רַחֵם עָלֵֽינוּ <br>
(טאַטֶע, אוֹי טאַטֶע)<br>
וְתֵן בְּלִבֵּנוּ בִּינָה<br>
לְהָבִין וּלְהַשְׂכִּיל<br>
לִשְׁמוֹעַלִ לְמוֹד וּלְלַמֵּד<br>
לִשְׁמוֹר  וְלַעֲשׂוֹת <br>
וּלְקַיֵּם אֶת כָּל דִּבְרֵי<br>
תַלְמוּד תּוֹרָתֶךָ בְּאַהֲבָה",,,"https://www.youtube.com/watch?v=zV_GSoaOJFo, https://www.youtube.com/watch?v=-DACmtfohHE"
"avinu malkeinu ein lanu melech,אָבִינוּ מַלְכֵּנוּ אֵין לָנוּ מֶלֶךְ",,אָבִינוּ מַלְכֵּנוּ אֵין לָנוּ מֶלֶךְ אֶלָּא אָתָּה,,,https://youtu.be/I5Z_D97X24g?t=76
Acheinu,,"אַחֵינוּ כָּל בֵּית יִשְׂרָאֵל, 
הַנְּתוּנִים בְּצָרָה וּבַשִּׁבְיָה, 
הָעוֹמְדִים בֵּין בַּיָּם וּבֵין בַּיַּבָּשָׁה, 
הַמָּקוֹם יְרַחֵם עֲלֵיהֶם
וְיוֹצִיאֵם מִצָּרָה לִרְוָחָה
וּמֵאֲפֵלָה לְאוֹרָה, 
וּמִשִּׁעְבּוּד לִגְאֻלָּה, 
הַשְׁתָּא בַּעֲגָלָא וּבִזְמַן קָרִיב.. ",,,https://youtu.be/q4PxCtN5BgE
Ilan Ilan,,"אִילָן אִילָן בַּמָּה אֲבָרֶכְךָ 
שֶׁיְּהוּ פֵּירוֹתֶיךָ מְתוּקִין
הֲרֵי פֵּירוֹתֶיךָ מְתוּקִין
שֶׁיְּהֵא צִילְּךָ נָאֶה
הֲרֵי צִילְּךָ נָאֶה
אֶלָּא יְהִי רָצוֹן 
שֶׁכׇּל נְטִיעוֹת
שֶׁנּוֹטְעִין מִמְּךָ יִהְיוּ כְּמוֹתְךָ",,,"https://www.youtube.com/watch?v=pSiwTwYYO94&pp=ygUJaWxhbiBpbGFu, https://youtu.be/VUaAAj3t_HU"
Ein Aroch,,"אֵין עֲרוֹךְ לְךָ, וְאֵין זוּלָתֶֽךָ
אֶֽפֶס בִּלְתֶּֽךָ, וּמִי דּֽוֹמֶה לָּךְ
אֵין עֲרוֹךְ לְךָ, הַ׳ אֱלֹקינוּ, בָּעוֹלָם הַזֶּה
 וְאֵין זוּלָתְךָ מַלְכֵּֽנוּ לְחַיֵּי הָעוֹלָם הַבָּא",,,"https://www.youtube.com/watch?v=eTBqH3QlTJQ, https://www.youtube.com/watch?v=qlpj_7qXmlY&pp=ygUPZWluIGFyb2NoIGxlY2hh"
"Proik, Prok",,"אֱלָהָא דִּי לֵהּ יְקַר וּרְבוּתָא
פְּרוֹק יַת עָנָךְ מִפּוּם אַרְיְוָתָא
וְאַפֵּיק יַת עַמֵּךְ מִגּוֹ גָלוּתָ
עַמֵּךְ דִּי בְחַרְתְּ מִכָּל אֻמַּיָּא",,,"https://www.youtube.com/watch?v=medQfTWMs8Q, https://www.youtube.com/watch?v=DLVLnKaSt1Q"
Eilecha,,"אֵלֶיךָ ה' אֶקְרָא; וְאֶל- ה', אֶתְחַנָּנ
שְׁמַע-ה' וְחָנֵּנִי; ה' הֱיֵה-עֹזֵר לִי ",,,https://www.youtube.com/watch?v=WvH3CdtkgQ0
Elokai ,,"אֱלקי נְשָׁמָה שֶׁנָּתַתָּ בִּי טְהורָה הִיא
אַתָּה בְרָאתָהּ, אַתָּה יְצַרְתָּהּ
אַתָּה נְפַחְתָּהּ בִּי וְאַתָּה מְשַׁמְּרָהּ בְּקִרְ
בִּי וְאַתָּה עָתִיד לִטְּלָהּ מִמֶּנִּי
וּלְהַחֲזִירָהּ בִּי לֶעָתִיד לָבוֹא",Baruch Levine,,https://www.youtube.com/watch?v=1a2oVRiiwyE
Al Tira,,"אַל תִּירָא כִּי יַעֲשִׁר אִישׁ
כִּי יִרְבֶּה כְּבוֹד בֵּיתוֹ. 
כִּי לֹא בְמוֹתוֹ יִקַּח הַכֹּל 
לֹא יֵרֵד אַחֲרָיו כְּבוֹדוֹ",Miami,,https://www.youtube.com/watch?v=1a2oVRiiwyE
Im Eshkochech,,"אִם אֶשְׁכָּחֵךְ יְרוּשָׁלָיִם, תִּשְׁכַּח יְמִינִי. 
תִּדְבַּק לְשׁוֹנִי לְחִכִּי אִם לֹא אֶזְכְּרֵכִי, 
אִם לֹא אַעֲלֶה אֶת יְרוּשָׁלַֽיִם
עַל רֹאשׁ שִׂמְחָתִי",Shwekey,,https://www.youtube.com/watch?v=3Em9oLEP5EM
"Im Hayu, Mesikus Hatorah",,"אִם הָיוּ בְּנֵי אָדָם מַרְגִּישִׁים
בִּמְתִיקוּת וַעֲרֵיבוּת טוּב הַתּוֹרָה
הָיוּ, הָיוּ מִשְׁתַּגְּעִים - וּמִתְלַהֲטִים אַחֲרֶיהָ
וְלֹא יֵחָשֵׁב בְּעֵינֵיהֶם, מְלוֹא עוֹלָם
כֶּסֶף וְזָהָב, לִמְאוּמָה
כִּי הַתּוֹרָה כּוֹלֶלֶת כָּל הַטּוֹבוֹת שֶׁבָּעוֹלָם",Yisroel Werdyger,,https://www.youtube.com/watch?v=BYevuiqL9QI
Ana Bikoach,,"אָנָּא בְּכֹחַ גְּדֻלַּת יְמִינְךָ תַּתִּיר צְרוּרָה
קַבֵּל רִנַּת עַמְּךָ  שַׂגְּבֵנוּ טַהֲרֵנוּ נוֹרָא",,,x
Ana Avdah,,"אֲנָא עַבְדָּא ,דְקֻדְשָׁא בְּרִיךְ הוּא",,,https://www.youtube.com/watch?v=z4e8FQhv1TM
Ana Hashem,,"אָנָּה ה', כִּי-אֲנִי עַבְדֶּךָ אֲנִי-עַבְדְּךָ, 
בֶּן-אֲמָתֶךָ; פִּתַּחְתָּ, לְמוֹסֵרָי",,,https://www.youtube.com/watch?v=g-sTY08ORU4&pp=ygUVYW5hIGhhc2hlbSBjYXJsZWJhY2gg
"Ani Yishaina, Pischi Li",,"אֲנִי יְשֵׁנָה וְלִבִּי עֵר קוֹל  דּוֹדִי דוֹפֵק
פִּתְחִי־לִי אֲחֹתִי רַעְיָתִי יוֹנָתִי תַמָּתִי",,,https://youtu.be/YZJQ3rZ-TQs
Ani Maamin,,"אֲנִי מַאֲמִין בֶּאֱמוּנָה שְׁלֵמָה
בְּבִיאַת הַמָּשִׁיחַ וְאַף עַל פִּי שֶׁיִּתְמַהְמֵהַּ
עִם כָּל זֶה אֲחַכֶּה לּוֹ בְּכָל יוֹם שֶׁיָּבוֹא",,,"https://youtu.be/Y3gSOBfIvLA, https://youtu.be/igcAmD8kuOI,"
Ani Maamin,,"אֲנִי מַאֲמִין בֶּאֱמוּנָה שְׁלֵמָה 
שֶׁהַבּוֹרֵא יִתְבָּרַךְ שְׁמוֹ 
הוּא בוֹרֵא וּמַנְהִיג לְכָל הַבְּרוּאִים 
וְהוּא לְבַדּוֹ עָשָׂה וְעוֹשֶׂה וְיַעֲשֶׂה
 לְכָל הַמַּעֲשִׂים ",,,https://www.youtube.com/watch?v=YztAoobKUwU&t=1s
Ekrah,,"אֶקְרָא לֵאלֹקים עֶלְיוֹן
לָאֵל גֹּמֵר עָלָי 
יִשְׁלַח מִשָּׁמַיִם וְיוֹשִׁיעֵנִי
חֵרֵף שֹׁאֲפִי סֶלָה ",Shalsheles,,https://www.youtube.com/watch?v=_I0z_IHzIdI
Esa Einai,,"אֶשָּׂא עֵינַי, אֶל-הֶהָרִים, מֵאַיִן יָבֹא עֶזְרִי 
עֶזְרִי מֵעִם ה' עֹשֵׂה שָׁמַיִם וָאָרֶץ 
הִנֵּה לֹא יָנוּם, וְלֹא יִישָׁן שׁוֹמֵר יִשְׂרָאֵל",,,https://www.youtube.com/watch?v=IGnfwtlqZ2M&pp=ygUJZXNhIGVpbmFp
Es Tzemach,,"אֶת־צֶֽמַח דָּוִד עַבְדְּךָ מְהֵרָה תַצְמִֽיחַ
וְקַרְנוֹ תָּרוּם בִּישׁוּעָתֶֽךָ
כִּי לִישׁוּעָתְךָ קִוִּֽינוּ כָּל הַיּוֹם",,,https://youtu.be/wMaHcF0Me7c
"Atoh Horaisa, Ayn Kamocha",,"אַתָּה הָרְאֵתָ לָדַעַת, כִּי ה' הוּא הָאֱלֹקִים 
אֵין כָּמוֹךָ בָאֱלֹקִים הַ׳ 
וְאֵין כְּמַעֲשֶׂיךָ אֵין עוֹד מִלְּבַדּוֹ",,,https://youtu.be/JA1wESz6iBg?t=48
Bilvovi,,"בִּלְבָבִי מִשְׁכָּן אֶבְנֶה לַהֲדַר כְּבוֹדוֹ
וּלמִּשְׁכָּן מִזְבֵּֽחַ אָשִׂים לְקַרְנֵי הוֹדוֹ
וּלְנֵר תָּמִיד אֶקַּח לִי אֶת–אֵשׁ הָעֲקֵידָה
וּלְקָרְבָּן אַקְרִיב לוֹ אֶת נַפְשִי הַיְחִידָה",,,https://youtu.be/VMftk982Epo
Baavur Avoseinu,,"בַּעֲבוּר אֲבוֹתֵינוּ שֶׁבָּטְחוּ בְךָ
וַתְּלַמְּדֵם חֻקֵּי חַיִּים כֵּן תְּחָנֵּנוּ וּתְלַמְּדֵנוּ
וְתֵן בְּלִבֵּנוּ לְהָבִין לִלְמוֹד וּלְלַמֵּד בְּאַהֲבָה ",,,https://youtu.be/7dFGoSctbyg
Bsheim Hashem,,"בְּשֵׁם הַשֵּׁם אֱלֹקי יִשְׂרָאֵל
מִימִינִי מִיכָאֵל וּמִשְּׂמֹאלִי גַּבְרִיאֵל
וּמִלְּפָנַי אוּרִיאֵל וּמֵאֲחוֹרַי רְפָאֵל 
רֹאשִׁי שְׁכִינַת אֵ-ל
לֹא תִירָא  מִפַּחַד לָיְלָה מֵחֵץ יָעוּף יוֹמָם",,, https://youtu.be/85SN4K8NdmM
"Bshoh, Anovim",,"בְּשָׁעָה שֶׁמֶּלֶךְ הַמָּשִׁיחַ בָּא
עוֹמֵד עַל גַּג בֵּית הַמִּקְדָּשׁ
וּמַשְׁמִיעַ לְיִשְׂרָאֵל וְאוֹמֵר
עֲנָוִים עֲנָוִים הִגִּיעַ זְמַן גְּאֻלַּתְכֶם 
וְאֵם אֵין אַתֶּם מַאֲמִינִים
רָאוּ בְּאוֹרִי שֶׁזּוֹרֵחַ",,,"https://www.youtube.com/watch?v=nb8MkUtdrpo, https://youtu.be/5v4kyAeL6eo,"
Gam Ki Eilech,,"גַּם כִּי-אֵלֵךְ בְּגֵיא צַלְמָוֶת
לֹא אִירָא רָע כִּי-אַתָּה עִמָּדִ
שִׁבְטְךָ וּמִשְׁעַנְתֶּךָ הֵמָּה יְנַחֲמֻנִי",,,https://youtu.be/fD7yBFImhX4?t=51
Habein Yakir Li,,"הֲבֵן יַקִּיר לִי אֶפְרַיִם אִם יֶלֶד שַׁעֲשׁוּעִים
כִּי מִדֵּי דַבְּרִי בּו זָכר אֶזְכְּרֶנּוּ עוֹד 
עַל כֵּן הָמוּ מֵעַי לו רַחֵם אֲרַחֲמֶנּוּ נְאֻם ה",,,https://youtu.be/OlJFy5C0MKI?t=27
Habeit,,"הַבֵּט מִשָּׁמַֽיִם וּרְאֵה
כִּי הָיִֽינוּ לַֽעַג וָקֶֽלֶס בַּגּוֹיִם
נֶחְשַֽׁבְנוּ כַּצֹּאן לָטֶֽבַח יוּבָל
לַהֲרוֹג וּלְאַבֵּד וּלְמַכָּה וּלְחֶרְפָּה
וּבְכָל־זֹאת שִׁמְךָ לֺא שָׁכָֽחְנוּ
נָא אַל־תִּשְׁכָּחֵֽנוּ: ",,,https://www.youtube.com/watch?v=3sko0Hw6gYY
Higoleh Na,,"הִגָלֵה נָא וּפְרש חָבִיבי עָלַי 
אֶת סֻכַת שְלומָךְ",,,https://youtu.be/CJd2-pAUso8
Heimah,,"הֵמָּה כָּרְעוּ וְנָפָלוּ וַאֲנַחְנוּ קַּמְנוּ וַנִּתְעוֹדָֽד
הַ׳ הוֹשִׁיעָה הַמֶּלֶךְ יַעֲנֵנוּ בְיוֹם־קרְאֵנוּ",,,https://www.youtube.com/watch?v=Y_jY2hqPeHw&
Hamalach,,"הַמַּלְאָךְ הַגֹּאֵל אֹתִי מִכָּל-רָע
יְבָרֵךְ אֶת-הַנְּעָרִים וְיִקָּרֵא בָהֶם שְׁמִי 
וְשֵׁם אֲבֹתַי אַבְרָהָם וְיִצְחָק 
וְיִדְגּוּ לָרֹב בְּקֶרֶב הָאָרֶץ",,,https://youtu.be/Y_jY2hqPeHw
Hishbati,,"הִשְׁבַּעְתִּי אֶתְכֶם בְּנוֹת יְרוּשָׁלָםִ 
אִם תִּמְצְאוּ אֶת דּוֹדִי מַה תַּגִּידוּ לוֹ
שֶׁחוֹלַת אַהֲבָה אָנִי",,,https://www.youtube.com/watch?v=CXiIJ8IZNKI
Vaani Bechasdecha,,"וַאֲנִי בְּחַסְדְּךָ בָטַחְתִּי יָגֵל לִבִּי בִּֽישׁוּעָתֶךָ 
אָשִׁירָה לַֽה' כִּי גָמַל עָלָֽי",,,https://www.youtube.com/watch?v=Dw-FJJOjglE
Veafilu Bihastara,,"וִאַפִילוּ בְּהַסתּוּרָה שֶבְּתוֹךְ הַסתּוּרָה 
בְּווַדַאי גַם שוּם נִמצָא הַשֵם יִתבָּרַך.
גַם מֵאַחוֹרֵי הַדבוּריִם הַקוּשִׁים 
הוּעוֹברִים עָלֶיךָ - אַנִי עוֹמֵד",,,https://www.youtube.com/watch?v=8Opq1AiZXco&pp=ygURdmVhZmlsdSBiZWhhc3RhcmE%3D
"Veatem Tihyu Li, Mamleches Kohanim",,"וְאַתֶּם תִּהְיוּ־לִי ,מַמְלֶכֶת כֹּהֲנִים וְגוֹי קָדוֹשׁ",,,https://www.youtube.com/watch?v=sssFjqCd3-0&pp=ygURbWFtbGVjaGVzIGtvaGFuaW0%3D
Vhaviosim,,"וַהֲבִיאוֹתִים אֶל-הַר קָדְשִׁי 
וְשִׂמַּחְתִּים בְּבֵית תְּפִלָּתִי
עוֹלֹתֵיהֶם וְזִבְחֵיהֶם לְרָצוֹן  עַל-מִזְבְּחִי
כִּי בֵיתִי  בֵּית-תְּפִלָּה יִקָּרֵא לְכָל-הָעַמִּים",,,https://www.youtube.com/watch?v=W1-ZlpSRQ2c
Vhu Keili,,"וְהוּא קֵלִי וְחַי גוֹאֲלִי וְצוּר חֶבְלִי בְּעֵת צָרָה 
וְהוּא נִסִּי וּמָנוֹס לִי מְנָת כּוֹסִי בְּיוֹם אֶקְרָא 
בְּיָדוֹ אַפְקִיד רוּחִי בְּעֵת אִישָׁן וְאָעִירָה
וְעִם רוּחִי גְּוִיָּתִי הַ’ לִי  וְלֹא אִירָא",Baruch Levine,,https://youtu.be/YyZvtxPcadk
Vhi Sheamda,,"וְהִיא שֶׁעָמְדָה לַאֲבוֹתֵיֽנוּ וְלָנֽוּ
שֶׁלֹא אֶחָד בִּלְבָד  עָמַד עָלֵיֽנוּ לְכַלּוֹתֵנֽוּ
וְהַקָּדוֹשׁ בָּרוּךְ הוּא מַצִּילֵנוּ מִיָּדָם",Yaakov Shwekey,,https://youtu.be/qoUj5obgdxg?t=53
Vihi Noam,,"וִיהִי נֹעַם הַ׳ אֱלֹקינוּ עָלֵינוּ 
וּמַעֲשֵׂה יָדֵינוּ כּוֹנְנָה עָלֵינוּ 
וּמַעֲשֵׂה יָדֵינוּ כּוֹנְנֵהוּ",Motty Steinmetz,,https://youtu.be/y7pL8QIb9Yo?t=33
Viyihu Zari,,"וְיִהְיוּ זַרְעִי וְזֶרַע זַרְעִי
תַּלְמִידֵי חֲכָמִים, וַחֲסִידִים 
אֲהוּבִים לְמַעְלָה וְנֶחְמָדִים לְמַטָּה
וְתַחְזִיק אֶת לְבָבָם, לְתּוֹרָה וַעֲבוֹדָה
הַכֹּל, בִּרְצוֹנְךָ הַטּוֹב
וְאֶזְכֶּה לִרְאוֹת לִרְאוֹת בָּנִים ,בָּנִים וּבְנֵי בָּנִים
עוֹסְקִים בַּתּוֹרָה ,בַּתּוֹרָה וּמִצְוֹת בֶּאֱמֶת",,,https://youtu.be/IFvn8df6TCg?t=29
Vhinei Hashem,,"וְהִנֵּה ה' נִצָּב עָלָיו
וּ""מְלֹא כָל הָאָרֶץ כְּבוֹדוֹ 
וּמַבִּיט עָלָיו וּבוֹחֵן כְּלָיוֹת
וָלֵב אִם עוֹבְדוֹ כָּרָאוּי ",,,https://www.youtube.com/watch?v=BPxd-sqtZyk
Umacha,,"וּמָחָה הַ׳ דִמָעה מֵעַל כָּל פָּנִים 
וחֶרפַּת עַמוֹ יָסִיר מֵעַל כָּל הָאָרֶץ",Baruch Levine,,https://youtu.be/_-umILisNLs?t=29
Vhareinu,,"וְהַרְאֵֽנוּ בְּבִנְיָנוֹ וְשַׂמְּחֵֽנוּ בְּתִקּוּנוֹ
וְהָשֵׁב כֹּהֲנִים לַעֲבוֹדָתָם 
וּלְוִיִּם לְשִׁירָם וּלְזִמְרָם 
וְהָשֵׁב יִשְׂרָאֵל לִנְוֵיהֶם 
וְשָׁם נַעֲלֶה וְנֵרָאֶה וְנִשְׁתַּחֲוֶה לְפָנֶֽיךָ 
בְּנֵה בֵיתְךָ כְּבַתְּחִלָּה ",,,https://youtu.be/QiadgWV4YxI?t=43
Vzakeini,,"וְזַכֵּנִי לְגַדֵל בָּנִים וּבְנֵי בָנִים
חֲכָמִים וּנְבוֹנִים
אוֹהַבֵי הַשֵם יִראֵי אֶלֹקִים 
אַנְשֵי אֶמֶת זֶרַע קוֹדֶשׁ בַשֵם דְּבֵקִים 
וּמְאִירִים אֶת הָעוֹלָם 
בַּתוֹרָה וּבְמַעֲשִים טוֹבִים 
וּבְכָל מְלֶאכֶת עֲבוֹדַת הַבוֹרֵא",,,https://youtu.be/QiadgWV4YxI?
Vihi Ratzon,,"וִיהִי רָצוֹן מִלִּפְנֵי אָבִינוּ שֶׁבַּשָּׁמַיִם
שֶׁיִּתֵּן בְּלִבְּךָ  אַהֲבָתוֹ וְיִרְאָתוֹ
וְתִהְיֶה יִרְאַת הַ’  עַל פָּנֶיךָ
כֹּל יְמֵי  יְמֵי חַיֶּיךָ 
וְיִתֶּן  לְךָ בָּנִים  בָּנִים  וּבָנוֹת
צַדִּיקִים וְצַדִּיקוֹת/וְצִדְקָנִיּוֹת
עוֹסְקִים בַּתּוֹרָה וּבְמִצְווֹת",Simcha Leiner,,https://youtu.be/e1iLc_4Gsdk?t=28
Vcho Mi Sheoskim,,"וְכָל מִי שֶׁעוֹסְקִים בְּצָרְכֵי צִבּוּר בֶּאֱמוּנָה
הַקָּדוֹשׁ  בָּרוּךְ הוּא יְשַׁלֵּם שְׂכָרָם
וְיָסִיר מֵהֶם כָּל מַחֲלָה 
וְיִרְפָּא  לְכָל גּוּפָם וְיִסְלַח לְכָל עֲוֹנָם
וְיִשְׁלַח בְּרָכָה וְהַצְלָחָ בְּכָל מַעֲשֵׂה יְדֵיהֶם
עִם כָּל יִשְׂרָאֵל אֲחֵיהֶם וְנֹּאמַר אָמֵן",Yehudah Green,,https://youtu.be/xi_EPclMZjY
Vlirushalayim,,"וְלִירוּשָלַיִם עִירְךָ בְּרַחֲמִים תָּשוּב
וְתִּשְׁכוֹן בְּתוֹכָהּ כַּאֲשֶׁר דִבַּרְתָּ
וּבְנֵה אוֹתָהּ בְּקָרוֹב בְּיָמֵינוּ בִּניַן עוֹלָם
וְכִסֵּא דָוִד עַבְדְּךָ מְהֵרָה לְתוֹכָהּ תָּכִין",,,https://youtu.be/snkxWQw0swQ
,,"וּמָחָה הַ׳ דִמָעה מֵעַל כָּל פָּנִים 
וחֶרפַּת עַמוֹ יָסִיר מֵעַל כָּל הָאָרֶץ ",, ,https://www.youtube.com/watch?v=0O0kMAlhLto&pp=ygUUdW1vY2hhIGJhcnVjaCBsZXZpbmU%3D
,,"וּמִשֶּׁפַע מִצְוַת תְּפִלִּין יִתְמַשֵּׁךְ עָלַי לִהְיוֹת לִי חַיִּים אֲרֻכִים וְשֶׁפַע קֹדֶשׁ  וּמַחֲשָׁבוֹת קְדוֹשׁוֹת
וּמִשֶּׁפַע מִצְוַת תְּפִלִּין יִתְמַשֵּׁךְ עָלַי 
בְּלִי הִרְהוּר חֵטְא  וְעָוֹן כְּלָל",Baruch Levine,,?
,,"וְנָחָה עָלָיו, רוּחַ הַ’ ,רוּחַ חָכְמָה וּבִינָה,
רוּחַ עֵצָה וּגְבוּרָה, רוּחַ דַּעַת וְיִרְאַת הַ",,,https://www.youtube.com/watch?v=jEp-VIEtV94
,,"ועַתָּה כִּתְבוּ לָכֶם אֶת־הַשִּׁירָה הַזֹּאת
וְלַמְּדָהּ אֶת־בְּנֵי־יִשְׂרָאֵל
תּוֹרָה הַקְּדוֹשָׁה הִתְחַנְּנִי בְּבַקָּשָׁ
.פְּנֵי הַצּוּר נַעֲרָץ בִּקְדֻשָּׁה ",Mordechai Ben David,,https://youtu.be/ShTNwy18Les
,,"וְתֵעָרֵב לְפָנֶיךָ עֲתִירָתֵנוּ
אָנָּא רַחוּם, בְּרַחֲמֶיךָ הָרַבִּים
הָשֵׁב שְׁכִינָתְךָ לְצִיּוֹן עִירֶךָ 
וְסֵדֶר הַעֲבוֹדָה לִירוּשָׁלָיִם",,,https://youtu.be/IKMFDzRP9Rg?t=73
,,"חַזֵּק קִרְיָתִי קֵל אֱלֹקִים עֶלְיוֹן
וְהָשֵׁב אֶת נְוָתִי בְּשִּׂמְחָה וּבְהִגָּיוֹן
יְשׁוֹרְרוּ שָׁם רְנָנַי לְוִיַי וְכֹהֲנַי
אָז תִּתְעַנַג עַל הַ׳ שַׁבַּת הַיּוֹם לַהַ׳",,,https://youtu.be/X7QQuNGbwb4?t=30
,,"חֲמוֹל עַל מַעֲשֶׂיךָ  וְתִשְׂמַח בְּמַעֲשֶׂיךָ
וְיֹאמְרוּ לְךָ חוֹסֶיךָ  בְּצַדֶּקְךָ עֲמוּסֶיךָ
תֻּקְדַּשׁ אָדוֹן עַל כָּל מַעֲשֶׂיךָ 
כִּי מַקְדִּישֶׁיךָ בִּקְדֻשָּׁתְךָ קִדַּשְׁתָ 
נָאֶה לְקָדוֹשׁ פְּאֵר מִקְּדוֹשִׁים",,,https://youtu.be/PybCbh52PUA?t=35
,,"חֲשׂוֹף זְרוֹעַ קָדְשֶׁךָ וְקָרֵב קֵץ הַיְשׁוּעָה
נְקֹם נִקְמַת  דַּם עֲבָדֶיךָ מֵאֻמָּה הָרְשָׁעָה
כִּי אָרְכָה לָנוּ הַיְשׁוּעָה וְאֵין קֵץ לִימֵי הָרָעָה
דְּחֵה אַדְמוֹן בְּצֵל צַלְמוֹן הָקֵם לָנוּ רוֹעֶה שִׁבְעָה",,,https://youtu.be/sS5yA6xpysU
,,"חֶסֶד יְסוֹבְבֶנּוּ ’הַבּוֹטֵחַ בַּהַ’
בֶּאֱמוּנָתוֹ יִחְיֶה צַדִּיק צַדִיק",,,https://youtu.be/Ckcbpun4_yI
,,"טוֹב לְהֹדוֹת לַה'  וּלְזַמֵּר לְשִׁמְךָ עֶלְיוֹן
לְהַגִּיד בַּבֹּֽקֶר חַסְדֶּֽךָ וֶאֱמוּנָתְךָ בַּלֵּילוֹת",,,https://youtu.be/WTSD2opc47c
,,"יִבָּנֶה הַמִּקְדָּשׁ עִיר צִיּוֹן תְּמַלֵּא
וְשָׁם נָשִׁיר שִׁיר חָדָשׁ וּבִרְנָנָה נַעֲלֶה",,,?
,,"יְמִין הַ’ רוֹמֵמָה, יְמִין הַ’ עֹשָׂה חָיִל",,,?
,,"יַעֲלֶה וְיָבֹא וְיַגִּיעַ וְיֵרָאֶה 
וְיֵרָצֶה וְיִשָּׁמַע וְיִפָּקֵד 
וְיִזָּכֵר זִכְרוֹנֵנוּ וּפִקְדוֹנֵנוּ 
וְזִכְרוֹן אֲבוֹתֵינוּ
וְזִכְרוֹן מָשִׁיחַ בֶּן דָּוִד עַבְדֶּךָ 
וְזִכְרוֹן יְרוּשָׁלַיִם עִיר קָדְשֶׁךָ
וְזִכְרוֹן כָּל עַמְּךָ בֵּית יִשְׂרָאֵל
לְפָנֶיךָ לִפְלֵטָה לְטוֹבָה   ",,,https://youtu.be/stA4jWKY-uo?t=47
,,"יַעֲלֶה תַּחֲנוּנֵנוּ מֵעֶרֶב
וְיָבוֹא שַׁוְעָתֵנוּ מִבֹּקֶר
וְיֵרָאֶה בַּקָּשָׁתֵנוּ עַד עָרֶב
וְיֵרָאֶה נַאֲקָתֵנוּ עַד עָרֶב",,,https://youtu.be/jL7uTLfzUMU
,,"יְשֲׁמֵך אֱלֹקִים כֶּאֶפְרַיִם וְכִמְנָשֶׁה
יְשֲׁמֱֳך אֶלׂקִים כְּשָׁרָה רִבְקָה רָחֵל וְלֱאָה 
יְבָרֶכְךָ ה' וְיִשְׁמְרֶךָ יָאֵר ה' פָּנָיו אֵלֶיךָ וִיחֻנֶּךָּ:
יִשָּׂא ה' פָּנָיו אֵלֶיךָ וְיָשֵׂם לְךָ שָׁלוֹם",,,https://youtu.be/sNIKkk4S1VI?t=32
,,"כְּאַיָּל תַּעֲרֹג עַל-אֲפִיקֵי-מָיִם
כֵּן נַפְשִׁי תַעֲרֹג אֵלֶיךָ אֱלֹקִים
צָמְאָה נַפְשִׁי  לֵאֱלֹקִים - לְקֵל חָי
מָתַי אָבוֹא; וְאֵרָאֶה פְּנֵי אֱלֹקים",,,"https://www.youtube.com/watch?v=SbCfwD5yo, https://youtu.be/CmrBRb6uCCg?t=29, https://youtu.be/117ED6_iEVU,"
,,"כַּד יַתבֻון יְשׂרָאֵל וְעֹסקִין בֽשִמחַת הַתֹּורָה
קוּדְשָׁא בְּריךְ הוּא אֹומֵר לְפַלמַיא דִילֵיה
חַזוּ בָּנַי חַבִיבַי ",,,https://youtu.be/PWbfWxxYCCo?t=23
,,"כֹּה אָמַר ה' זָכַרְתִּי לָךְ חֶסֶד נְעוּרַיִךְ
אַהֲבַת כְּלוּלֹתָיךְ לֶכְתֵּךְ אַחֲרַי בַּמִּדְבָּר 
בְּאֶרֶץ לֹא זְרוּעָה",,,https://youtu.be/RGeU66lU80w
,,"כִּי הוּא לְבַדּוֹ פּוֹעֵל גְּבוּרוֹ עֹשֶׂה חֲדָשׁוֹת
בַּֽעַל מִלְחָמוֹת זוֹרֵֽעַ צְדָקוֹת 
מַצְמִֽיחַ יְשׁוּעוֹת בּוֹרֵא רְפוּאוֹת 
נוֹרָא תְהִלּוֹת אֲדוֹן הַנִּפְלָאוֹת",Yossi Hecht,,https://youtu.be/enzW30WrYqM
,,"כִּי לַהַּ׳ הַמְלוּכָה וּמוֹשֵל בַּגוֹיִים
וְהָיָה הַּ׳ לְמֶלֶך עַל כָּל הָאָרֶץ
בַּיוֹם הַהוּא יִהיֶה הַּ׳ אֶחָד וּשׁמוֹ אֶחָד ",,,https://youtu.be/furTMTmuYbs
,,"כִּי קָרוֹב  אֵלֶיךָ הַדָבָר מְאוֹד
בְּפִיךָ  וּבִלְבָבְךָ לַעֲשׂוֹתוֹ",Eitan katz,,https://youtu.be/GNf2zRpprPo
,,"כָּל הָעוֹלָם כֻּלוֹ גֶשֶׁר צַר מְּאֹד 
וְהָעִיקָר לֹא לְפַחֵד כְּלַל",,,x
,,"כֶּתֶר יִתְּנוּ לְךָ  ה' אֱלֹקינוּ
מַלְאָכִים הֲמוֹנֵי מַעְלָה 
עִם עַמְּךָ יִשְׂרָאֵל קְבוּצֵי מַטָּה
יַחַד כֻּלָּם קְדֻשָּׁה לְךָ יְשַׁלֵּשׁוּ",Isaac Honig,,https://youtu.be/sUJ_5DjSSpc
,,"לֵב טָהוֹר  בְּרָא-לִי אֱלֹקים
 וְרוּחַ נָכוֹן  חַדֵּשׁ בְּקִרְבִּי
 אַל-תַּשְׁלִיכֵנִי מִלְּפָנֶיךָ
 וְרוּחַ קָדְשְׁךָ אַל-תִּקַּח מִמֶּנִּי",,,?
,,לוּלֵי תוֹרָתְךָ שַׁעֲשֻׁעָי אָז אָבַדְתִּי בְעָנְיִֽ,,,https://youtu.be/9Xu1CD83bjw
,,לְךָ אָמַר לִבִּי בַּקְּשׁוּ פָנָי אֶת פָּנֶיךָ ה אֲבַקֵּֽשׁ,,,?
,,"לַכֹּל זְמָן וְעֵת ... תַּחַת הַשָּׁמָיִם עֵת לֶאֱהֹב
וְעֵת לִשְׂנֹא עֵת מִלְחָמָה וְעֵת שָׁלוֹם ",,,https://youtu.be/gACSLkh_tbY
,,"לְמַעַנְךָ אֶלקֵינוּ עֲשֵׂה וְלא לָנוּ 
רְאֵה עֲמִידָתֵנוּ  דַּלִּים וְרֵקִים 
הַנְּשָׁמָה לָךְ וְהַגּוּף פָּעֳלָךְ 
חוּסָה עַל עֲמָלָךְ הַנְּשָׁמָה לָךְ ",,,https://youtu.be/c08WY2MNCH8
,,"לְמַעַן אַחַי וְרֵעָי אֲדַבְּרָה נָּא שָׁלוֹם בָּךְ 
לְמַעַן בֵּית ה׳ אֱלוֹהֵינוּ אֲבַקְשָׁה טוֹב לָךְ",,,https://youtu.be/OIBdca-t-_M
,,"לְעוֹלָם יְהֵא אָדָם  יְרֵא שָמַים
טַאטֶע טַאטֶע טַאטֶע אִיך וִויל זַיין 
אוי אִיך וִויל זַיין אַ יְרֵא שָמַים",,,https://youtu.be/cKBalZFrfTE
